{
  "$schema": "http://json-schema.org/draft-04/schema#",
  "type": "object",
  "properties": {
    "get": {
      "type": "string"
    },
    "parameters": {
      "type": "array",
      "items": {}
    },
    "errors": {
      "type": "array",
      "items": {}
    },
    "results": {
      "type": "integer"
    },
    "response": {
      "type": "array",
      "items": [
        {
          "type": "string"
        }
      ]
    }
  },
  "required": [
    "get",
    "parameters",
    "errors",
    "results",
    "response"
  ]
}